comment,attachments,title,postedDate
"Artificial intelligence, in its current form, is largely trained on stolen media from various sites and creators, with blatant disregard for permission to use the stolen media.  Many artists, writers, and other creators do not grant permission to use their works to train algorithms, and those in support of artificial intelligence view it as a way of replacing creators, despite the algorithms merely cobbling together something from existing parts taken from their original creators.  It has reached a point that creators have been forced to use external means of protecting their creations, such as visual artists utilizing the software Glaze to mask their work, which those training artificial intelligence have called &quot;poisoning&quot; the algorithms--all but admitting that they do not bother to contact the creators to use their work.<br/><br/>In its current state, artificial intelligence is little more than a Frankenstein&#39;s monster of parts stolen from other creators.  Those utilizing artificial intelligence tout their &quot;hard work&quot;, when it is little more than feeding a description and stolen content into a program that spits out a hodgepodge for them.  The true hard work is that of the creators who made the content in the first place, pouring hours upon hours into their work only for others to decide &quot;I can do that too&quot; and steal it for selfish purposes.  Artificial intelligence is a blatant mockery of media creation, and can never replace the original creators; &quot;content&quot; produced by artificial intelligence cannot be granted any form of copyright protection, as there is nothing original about it to protect.  To allow &quot;content&quot; produced by these algorithms the safety of copyright only reinforces the belief that the original creators cannot protect their work, and in time it will lead to a severe drought of original content and an upsurge of algorithmic regurgitation.",[],"Comment from Ross, Sami-Jo",2023-10-31T04:00:00Z
"Ai writing and art is almost entirely comprised of stolen works, sometimes even dropping watermarks onto their generated images. It would be disrespectful to anybody out there actually creating anything legitimate to allow these random generations to be owned and copyrighted. The lines between actual art and generated content would become much harder to cross and devalue any actual work a human being is doing. Also the idea that somebody would copyright something that they themselves by definition CANNOT recreate seems ridiculous to me.",[],"Comment from Catling , Meghan ",2023-10-31T04:00:00Z
"AI is a tool that could be helpful in areas of science and some workforce automation (with proper limits and not replacements of human workers), but it should not be applied to art. AI is about feeding the correct information to the system and with art, the only way to do that is by stealing people&rsquo;s works to show AI how to make art. AI should not be used in this space. However, if it is, there needs to be safeguards and compensation, especially in Hollywood. Writers and actors should be able to work with AI and not be dominated by it. If AI infringes on copyright, the guilty party should be fined for copyright infringement. It should not be allowed to replace human artists. It needs conditions and when those conditions are violated, fines must be imposed. Technology should be used to improve human lives not replace human livelihoods.",[],"Comment from Reddy, Jessica",2023-10-31T04:00:00Z
"&quot;Artificial intelligence,&quot; as it is commonly known, is simply predictive text. An algorithm. There is nothing &quot;intelligent&quot; about it. ChatGPT and the like are built by scraping data and writing from the internet, very often without the original author&#39;s consent. This is, quite simply, theft. And the output of a computer program built on stolen data should not be allowed copyright.",[],"Comment from Gumeny , Eirik",2023-10-31T04:00:00Z
"I do not believe AI work, as it stands, should be copyrighted. Our current AI are not truly artificial intelligence--instead, they are statistic models trained on the work of human writers and creators. They are not truly creating something new, merely filling in the blanks when prompted. The copyrighting of AI created materials will see the bankruptcy of human creators, the loss of art as a way of life, and the in-sustainability of our culture. How are we to compete against computer models that are trained on our creations? How are we to be small artists when large business and conglomerates can copyright products made off of our work? How can we fight that? Copyrighting AI creations hurts everyone. ",[],"Comment from Iriel, Kate",2023-10-31T04:00:00Z
"Unregulated AI is dangerous as a tool to spread misinformation, as well as a way for large corporations to try and get around paying people living wages. I am a firm believer that AI generated work should NOT be copyright-able. All AI was trained on writing, photos, and art that didn&#39;t consent to being used that way with no reimbursement. Keep copyright to human made works",[],"Comment from Collins, Mandy",2023-10-31T04:00:00Z
"Hello, I am a concept artist in the game industry and I am concerned with unregulated generative AI because of threats to copyright and livelihoods. I have always been interested in developments in technology and science, but tools to &ldquo;make people&rsquo;s lives easier&rdquo; should not steal from them without consent to populate a huge database, a database that is the sole reason for the existence of genAI companies&rsquo; profits. ",[],"Comment from Lansdell, Sara",2023-10-31T04:00:00Z
"- I don&#39;t believe AI generated art should qualify for copyright on the grounds that it is not produced through human intentionality. <br/>- Intentionality is one of the definitions of what makes art &#39;art&#39;.<br/>- AI as a term tricks the reader/viewer into believing there is thought involved, rather than applied statistical analysis. <br/>- current AI practices involve unethical data scraping from creators and artists who have not decided of their own volition to contribute, therefore it is violating their own inherent copyright.<br/>- Current AI modes of learning favour confirming and then inflating biases in our societies that will continue to perpetuate those myths.<br/>- AI is not ready for this work.  It should not at this stage even be called &#39;Intelligence&#39;, rather it should be called what it actually is: automatic iterative generation.",[],"Comment from Dawson-Marsh, Matthew",2023-10-31T04:00:00Z
"Use of AI and training AI on other people&#39;s work and intellectual property or likeness should be far more regulated and compensated accordingly. It&#39;s pretty horrifying as an artist to think that someone can just pick up what you&#39;ve done, feed it to an AI algorithm, and have it spit out something similar and have someone call it your work. Not to mention having your work used to train said AI when you have not been asked nor given compensation. Training AI algorithms on people&#39;s faces, words, voices, art, photos, etc should require significant payment to the owners of said property every time said AI algorithm is used.",[],"Comment from Nudelman, Nicole",2023-10-31T04:00:00Z
"AI should just be used as an educational tool, not for stealing an actors image for use as an extra.  Acting is an art, not a graphic.  Writing takes REAL intelligence, not artificial.  Writers &amp; actors also are good enough to work very challenging hours to make a show work, giving up time slots that normal people use to spend with family or tending to one&rsquo;s personal life.  Why on earth should they be punished for their talent&rsquo;s &amp; flexibility of time - OR be forced into homelessness?  My suggestion is to stop looking for ways to be cheap and lazy - and chose a moral high ground instead.  You&rsquo;re going to want to be on the right side of history on these issues.  AI won&rsquo;t be writing the history books, the people you hurt will.  ",[],"Comment from Paap, Dawn",2023-10-31T04:00:00Z
"The data scraping of the internet and training of AI on copyrighted works are unethical at best and the potential for harm is so high when it comes to AI-generated works (as we are already seeing with AI &ldquo;written&rdquo; foraging books where misinformation has the potential to be deadly). AI doesn&rsquo;t learn, it is advanced applied statistics and it cannot be held responsible for the harm caused by the lies it creates and spreads. If it cannot have accountability it should not receive the same protections as human authorship.<br/><br/>Additionally, corporate interests are trying to remove the human element from creative projects and this is bad not only for creatives (authors, artists, writers, actors) but for the environment as AI requires so many resources to run. <br/><br/>Authors are now having to battle websites that refuse to take down AI-generated books with their names attached to them. Countless numbers of artists and creative individuals who rely on their work are now having it stolen, manipulated, and repackaged to be sold and profited off of by thieves using AI software. Not to mention the untold amounts of misinformation that is being pushed out using AI as well. In the wrong hands, AI is a massive detriment to us all.",[],"Comment from White, Audrey",2023-10-31T04:00:00Z
"Dear U.S. Copyright Office,<br/><br/>I&#39;m a member of the Writers Guild of America and I urge the U.S. Copyright Office to prioritize human creativity and creative workers during its inquiry into artificial intelligence and copyright. The recently concluded 148-day WGA strike and ongoing SAG-AFTRA strike highlight the urgency of artificial intelligence (AI) issues for creative workers. The new WGA agreement contains important protections, prohibiting media companies from using AI to devalue our work. Writers, however, cannot address all of our concerns through collective bargaining&mdash;we need public policy solutions too. <br/><br/>AI models that generate art replace human creativity through the theft of our work. Such AI-generated work should not be entitled to copyright protection. Only human artists can create original art by drawing on our unique lived experience. Writers work to develop and maintain careers based on their individual voices. AI models, by contrast, are fed the work we create, and then regurgitate and mimic us in their outputs. Film and television writers are employees; we predominantly create works for hire and are thus not copyright holders, but like other rightsholders, WGA members should be protected by a statutory right to consent to the use of our work to train AI models and should be compensated fairly if we choose to do so. AI technology as it is currently being implemented poses a profound threat to writers and the integrity of our creative lives and work. <br/><br/>Thank you for consideration of my comments.<br/><br/>Sincerely,<br/>Sarah W Gallagher<br/>New York, NY",[],"Comment from Gallagher, Sarah W",2023-11-01T04:00:00Z
"Dear U.S. Copyright Office,<br/><br/>I&#39;m a member of the Writers Guild of America and I urge the U.S. Copyright Office to prioritize human creativity and creative workers during its inquiry into artificial intelligence and copyright. The recently concluded 148-day WGA strike and ongoing SAG-AFTRA strike highlight the urgency of artificial intelligence (AI) issues for creative workers. The new WGA agreement contains important protections, prohibiting media companies from using AI to devalue our work. Writers, however, cannot address all of our concerns through collective bargaining&mdash;we need public policy solutions too. <br/><br/>AI models that generate art replace human creativity through the theft of our work. Such AI-generated work should not be entitled to copyright protection. Only human artists can create original art by drawing on our unique lived experience. Writers work to develop and maintain careers based on their individual voices. AI models, by contrast, are fed the work we create, and then regurgitate and mimic us in their outputs. Film and television writers are employees; we predominantly create works for hire and are thus not copyright holders, but like other rightsholders, WGA members should be protected by a statutory right to consent to the use of our work to train AI models and should be compensated fairly if we choose to do so. AI technology as it is currently being implemented poses a profound threat to writers and the integrity of our creative lives and work. <br/><br/>Thank you for consideration of my comments.<br/><br/>Sincerely,<br/>Lon Zimmet<br/>Basking Ridge, NJ",[],"Comment from Zimmet, Lon",2023-11-01T04:00:00Z
"Dear U.S. Copyright Office,<br/><br/>I&#39;m a member of the Writers Guild of America and I urge the U.S. Copyright Office to prioritize human creativity and creative workers during its inquiry into artificial intelligence and copyright. The recently concluded 148-day WGA strike and ongoing SAG-AFTRA strike highlight the urgency of artificial intelligence (AI) issues for creative workers. The new WGA agreement contains important protections, prohibiting media companies from using AI to devalue our work. Writers, however, cannot address all of our concerns through collective bargaining&mdash;we need public policy solutions too. <br/><br/>AI models that generate art replace human creativity through the theft of our work. Such AI-generated work should not be entitled to copyright protection. Only human artists can create original art by drawing on our unique lived experience. Writers work to develop and maintain careers based on their individual voices. AI models, by contrast, are fed the work we create, and then regurgitate and mimic us in their outputs. Film and television writers are employees; we predominantly create works for hire and are thus not copyright holders, but like other rightsholders, WGA members should be protected by a statutory right to consent to the use of our work to train AI models and should be compensated fairly if we choose to do so. AI technology as it is currently being implemented poses a profound threat to writers and the integrity of our creative lives and work. <br/><br/>Thank you for consideration of my comments.<br/><br/>Sincerely,<br/>erik agard<br/>kansas city, MO",[],"Comment from agard, erik",2023-11-01T04:00:00Z
"Dear U.S. Copyright Office,<br/><br/>I&#39;m a member of the Writers Guild of America and I urge the U.S. Copyright Office to prioritize human creativity and creative workers during its inquiry into artificial intelligence and copyright. The recently concluded 148-day WGA strike and ongoing SAG-AFTRA strike highlight the urgency of artificial intelligence (AI) issues for creative workers. The new WGA agreement contains important protections, prohibiting media companies from using AI to devalue our work. Writers, however, cannot address all of our concerns through collective bargaining&mdash;we need public policy solutions too. <br/><br/>AI models that generate art replace human creativity through the theft of our work. Such AI-generated work should not be entitled to copyright protection. Only human artists can create original art by drawing on our unique lived experience. Writers work to develop and maintain careers based on their individual voices. AI models, by contrast, are fed the work we create, and then regurgitate and mimic us in their outputs. Film and television writers are employees; we predominantly create works for hire and are thus not copyright holders, but like other rightsholders, WGA members should be protected by a statutory right to consent to the use of our work to train AI models and should be compensated fairly if we choose to do so. AI technology as it is currently being implemented poses a profound threat to writers and the integrity of our creative lives and work. <br/><br/>Thank you for consideration of my comments.<br/><br/>Sincerely,<br/>Luke Paradise<br/>Nashville, TN",[],"Comment from Paradise, Luke",2023-11-01T04:00:00Z
"Dear U.S. Copyright Office,<br/><br/>I&#39;m a member of the Writers Guild of America and I urge the U.S. Copyright Office to prioritize human creativity and creative workers during its inquiry into artificial intelligence and copyright. The recently concluded 148-day WGA strike and ongoing SAG-AFTRA strike highlight the urgency of artificial intelligence (AI) issues for creative workers. The new WGA agreement contains important protections, prohibiting media companies from using AI to devalue our work. Writers, however, cannot address all of our concerns through collective bargaining&mdash;we need public policy solutions too. <br/><br/>AI models that generate art replace human creativity through the theft of our work. Such AI-generated work should not be entitled to copyright protection. Only human artists can create original art by drawing on our unique lived experience. Writers work to develop and maintain careers based on their individual voices. AI models, by contrast, are fed the work we create, and then regurgitate and mimic us in their outputs. Film and television writers are employees; we predominantly create works for hire and are thus not copyright holders, but like other rightsholders, WGA members should be protected by a statutory right to consent to the use of our work to train AI models and should be compensated fairly if we choose to do so. AI technology as it is currently being implemented poses a profound threat to writers and the integrity of our creative lives and work. <br/><br/>Thank you for consideration of my comments.<br/><br/>Sincerely,<br/>Rebecca Kirsch<br/>Culver City, CA",[],"Comment from Kirsch, Rebecca",2023-11-01T04:00:00Z
"Dear U.S. Copyright Office,<br/><br/>I&#39;m a member of IATSE and I urge the U.S. Copyright Office to prioritize human creativity and creative workers during its inquiry into artificial intelligence and copyright. The recently concluded 148-day WGA strike and ongoing SAG-AFTRA strike highlight the urgency of artificial intelligence (AI) issues for creative workers. The new WGA agreement contains important protections, prohibiting media companies from using AI to devalue our work. Writers, however, cannot address all of these concerns through collective bargaining&mdash;we need public policy solutions too. <br/><br/>AI models that generate art replace human creativity through the theft of our work. Such AI-generated work should not be entitled to copyright protection. Only human artists can create original art by drawing on our unique lived experience. Writers work to develop and maintain careers based on their individual voices. AI models, by contrast, are fed the work we create, and then regurgitate and mimic us in their outputs. Film and television writers are employees; we predominantly create works for hire and are thus not copyright holders, but like other rightsholders, WGA members should be protected by a statutory right to consent to the use of our work to train AI models and should be compensated fairly if we choose to do so. AI technology as it is currently being implemented poses a profound threat to writers and the integrity of our creative lives and work. <br/><br/>Thank you for consideration of my comments.<br/><br/>Sincerely,<br/>Lizzie Boyle",[],"Comment from Boyle, Lizzie",2023-11-01T04:00:00Z
"Dear U.S. Copyright Office,<br/><br/>I think one possible solution is to &ldquo;federalize&rdquo; the right of publicity as applied to voice, image and likeness embodied in copyrighted audio and audiovisual works. The resulting copyright interest should be allocated to the individual whose voice and/or image are included in the underlying work (and not the &ldquo;employers for hire&rdquo;). Regulations can be promulgated to delineate which uses are &ldquo;derivative works&rdquo; of the original copyrights and which are &ldquo;AI infringements&rdquo; of the newly federalized right of publicity. This is a problem that cannot be effectively regulated through the application of disparate state right of publicity laws. <br/><br/>Sincerely,<br/>Daniel Johnson<br/>Sherman Oaks, CA",[],"Comment from Johnson, Daniel",2023-11-01T04:00:00Z
"Dear U.S. Copyright Office,<br/><br/>I&#39;m a member of the Writers Guild of America and I urge the U.S. Copyright Office to prioritize human creativity and creative workers during its inquiry into artificial intelligence and copyright. The recently concluded 148-day WGA strike and ongoing SAG-AFTRA strike highlight the urgency of artificial intelligence (AI) issues for creative workers. The new WGA agreement contains important protections, prohibiting media companies from using AI to devalue our work. Writers, however, cannot address all of our concerns through collective bargaining&mdash;we need public policy solutions too. <br/><br/>AI models that generate art replace human creativity through the theft of our work. Such AI-generated work should not be entitled to copyright protection. Only human artists can create original art by drawing on our unique lived experience. Writers work to develop and maintain careers based on their individual voices. AI models, by contrast, are fed the work we create, and then regurgitate and mimic us in their outputs. Film and television writers are employees; we predominantly create works for hire and are thus not copyright holders, but like other rightsholders, WGA members should be protected by a statutory right to consent to the use of our work to train AI models and should be compensated fairly if we choose to do so. AI technology as it is currently being implemented poses a profound threat to writers and the integrity of our creative lives and work. <br/><br/>Thank you for consideration of my comments.<br/><br/>Sincerely,<br/>Nicole Silverberg<br/>LOS ANGELES, CA",[],"Comment from Silverberg, Nicole",2023-11-01T04:00:00Z
