comment,attachments,title,postedDate
"AI &#39;authorship&#39; horrifies me for several reasons.<br/>1. The work currently created by programs like ChatGPT is prone to error, and tends not to get fact-checked. Propagation of misinformation is injurious to the public good.<br/>2. AI generation of text, art, and voices as a cheap alternative to live workers damages their livelihood in a very real way. In particular, young people trying to enter these fields -- without any kind of marketable name or body of work to tempt potential employers -- are likely to be starved out before they even start. That damages people&#39;s employment opportunities, and it damages artistic traditions as a collection of techniques passed down from experienced workers to their juniors. It&#39;s astroturf compared to a blossoming meadow.<br/>3. Many AI generators have learned on content that was copyrighted and without the consent of the creators, with no royalties in sight. The owners of these generators claim that the source content is scrambled enough that they&#39;re not infringing fair use, but I&#39;ve seen AI &#39;art&#39; reproduce watermarks before now. It is, at best, tacky.<br/><br/>Thank you for listening to my opinions.",[],"Comment from Pegg, Catherine",2023-10-31T04:00:00Z
I believe it is unethical for people to stake claims on work they did not directly create.,[],Comment from Talun Art LLC,2023-10-31T04:00:00Z
"AI art I have seen online has overwhelmingly stolen from real, human artists/creators without giving credit or compensation of any kind. This is harmful to creators because their creations are reduced to mere data points and the creators receive nothing in return. AI programs require loads of data created by people in order to function and improve. The people whose data is used by AI must be compensated when AI engines make use of their art and other data. Compensation to creators/artists provides recognition of their work and shows that what they make and do is valued. Furthermore, creators should have the right to decide when they do not want AI to be able to use something they made. The consent of the human creator is vital. ",[],Comment from Anonymous,2023-10-31T04:00:00Z
All content produced by AI is based on uncredited interpolation of someone else&rsquo;s work.  No on should be permitted to copyright or profit from this inherently stolen work.,[],"Comment from Smith, Jason",2023-10-31T04:00:00Z
"At the beginning if AI content generation, it was seen as a joke. Gradually, people realised how AI art worked and protested. The protests were ignored, however, until AI art became &#39;uncool&#39;. Now there are AI voice generators that are being used. AI voice technology is extremely damaging to both people who profit off of their voice (Voice Actors, Musicians, etc.) and people in public positions. If AI voice content becomes more normalised, companies will start leaning towards using AI voice technology over hiring voice actors. This event would cause many people to lose their jobs. AI voice has also been used to generate NSFW content of characters and people who are under the age of 18. The same issue has been prominent with AI art generation as well. <br/>AI voice has been compared to vocal synthesisers. There is one main difference that AI voice users disregard. The voicebanks and characters from vocal synthesisers are created with the voices of PAID individuals. Vocal synthesisers also do not sound identical to the voice provider, which creates a distinct barrier between the voice provider and the voicebank used in the synthesiser. The voice provider is compensated each time their voicebank is bought, sometimes as well as additional royalties. <br/>I firmly believe that AI content generation technology should not be used in most situations. There are instances where AI voice technology is used to replicate certain voices from deceased actors. I have no problem with that as long as the families of the actors are compensated for the use of the voice. <br/>In conclusion, AI generation technology should only be used if there are strict copyright laws and regulations keeping users in check. AI generation technology should if the original creators/actors are properly compensated.",[],"Comment from Claassen, Meridian",2023-10-31T04:00:00Z
This technology absolutely needs more regulation. It&rsquo;s beyond unethical to train a machine on someone else&rsquo;s work and use it to output content that you then claim as your own. I think AI can be used for wonderful things. It should be. But absolutely not through theft and dishonesty. We need something to regulate it or it&rsquo;s going to hurt a lot of people.,[],"Comment from Jones, Madison",2023-10-31T04:00:00Z
"Hello, I am an author based in Texas with various concern regarding unregulated AI because of threats to copyright and livelihoods. This technology is already doing damage due to lack of regulations, and copyright holders currently have little to no recourse.<br/><br/>Instances of AI users taking advantage of the fact that many artists, authors, actors, models, etc. need to use the internet to market their work. They take the posts to put the person&rsquo;s content into a machine and then trying to sell these pieces off as the user&rsquo;s original work, when nothing is original about it. Imagine you made various cookies for a bake sale and another vendor comes to your table, steals your cookies, and then puts the pilfered sweets on a platter on their table and passes them off as their own cookies. That&rsquo;s what&rsquo;s happening in real life.<br/><br/>Worse is now we&rsquo;ve seen instances of people trying to sell foraging guides to make money on Amazon made with AI even going as far as to make-up fake authors with fake credentials. These foraging guides will tout that various inedible flora is wholly edible which will lead to illness, at best, and death, in a worse case scenario. <br/><br/>Regulations are a necessity with this technology as copyright holders and working artists need to know their creations can be protected and, given the above paragraph, will save many people from hospital visits or wrongful death due to someone taking advantage of a lack of regulations to make money.   This will not hinder any innovation, it will support it. The current unregulated generative model hurts hard workers in the field of art and entertainment and will soon hurt the average citizen. <br/>",[],Comment from Anonymous,2023-11-01T04:00:00Z
"1. As described above, generative AI systems have the ability to produce material that would be copyrightable [...]<br/><br/>My view of AI currently is nigh-catastrophic. For a technology that has been pitched to the public as a grand jump in what we&#39;re capable of, the most dramatic effect I have personally witnessed is AI/ML threatening the livelihoods of artists and writers who already are forced to subsist on sub-par wages.<br/><br/>6. What kinds of copyright-protected[...]<br/><br/>6.1. How or where do developers of AI models acquire the materials or datasets that their [...]<br/><br/>OpenAI, one of the big language learning models, was recently discovered to be trained on fanfiction of all things. There was no request for access to fanfic authors&#39; work. It just happened, because it&#39;s assumed that anything posted publicly online is scrappable. This is deeply demoralizing and also seems like an incredibly stupid stance. Does every public article of a news site become fair game? If I copy and pasted someone&#39;s work and posted it as my own, I would rightly be dragged over the coals, and if I were financially benefiting from that theft I would deserve to be sued.<br/><br/>I am fine with public domain work or work that is directly commissioned by developers to be used in learn models. For me, it is extremely important that people OPT INTO these data models, not be tricked into OPT OUT systems.<br/><br/>Also, the idea that a large collection of written or artistic work might be offered up to teach large scale models. Lets say a massive site that has been active for a very long time, such as ArtStation, suddenly emails ALL USERS to say &quot;Hello, we are going to share your personal artwork with this AI/ML data set. If you do NOT want to be included, let us know!&quot;<br/><br/>That&#39;s a fine idea but is equally useless. What about users who have changed email addresses and miss that vitally important email? What about people who have moved onto new sites? What about people who have PASSED AWAY who stand to lose this basic protection of their work through zero fault of their own?<br/><br/>The only ethical data sets are ones that the artists OPT INTO with full understanding of the process.<br/><br/>8. Under what circumstances would the unauthorized use of copyrighted works to train AI models constitute fair use?[...]<br/><br/>There is no circumstance where unauthorized use of copyright works should be used to train AI. Fair Use should not apply to AI/ML because when a human being creates work protected by Fair Use, there is intentionality and interpretation happening. An AI is reacting to a prompt. There is no intentionality or interpretation, only using someone else&#39;s work to generate more of that exact work.<br/><br/>8.3. The use of copyrighted materials in a training [...]Does it make a difference if funding for these noncommercial [...]<br/><br/>I love these questions here because the initial questions made me think &quot;well perhaps for research purposes it would be ethical&quot; but the subsequent two additions reminded me why, no, actually, it would not be ethical. In the same way Accuweather profits off the work of the NOAA, the perfect ethical dream of a Moral Use Of AI would inevitably be turned into profit. No. Keep copyrighted and unauthorized work out of datasets, even non-profit and research-focused AI/ML.<br/><br/>9. Should copyright owners have to affirmatively consent (opt in) [...]<br/><br/>Opt in with robust, easily-understand parameters and legal agreements is the only acceptable consent. Opt out is not viable for the reasons I described above.<br/><br/>9.4. If an objection is not honored, what remedies should be [...]<br/><br/>I think if the objection is not honored, the owner of the dataset should be forced to either discard the entire dataset immediately or to give 100% royalities to every single result of that data set. I want the punishment for not honoring such a request to be so severe it completely dictates the way these things are operated.<br/><br/>15. In order to allow copyright owners to[...]<br/><br/>Yes.<br/><br/>18. Under copyright law, are there circumstances when a human [...]<br/><br/>The only situation where AI-generated work should be copyrightable is if the dataset was exclusively sourced from the author. <br/><br/>20. Is legal protection for AI-generated material desirable [...]<br/><br/>I don&#39;t care. I feel like I have watched AI/ML generated art go from an interesting oddity to a massive threat to truth, art, writing, and the livelihoods of everyone who makes a logo for a new soda, who does art commissions of people&#39;s pets, who writes bestselling novels, who works as a script doctor. <br/><br/>The people behind this technology have proven over and over and over and over EXHAUSTIVELY that are willing to screw over every creative person they can all in the name of profit. I don&#39;t think generative AI is &#39;ready for prime time&#39; so to speak and until these issues are resolved, I don&#39;t care about encouraging the development of the technology. Because they&#39;ve proven they don&#39;t care about art and the human labor behind it.",[],"Comment from Martino, Danielle",2023-11-01T04:00:00Z
"My name is Daniel. I work as a concept artist in a AAA studio.<br/><br/>I have personal work as well as copyrighted work up on social media as well as portfolio sites.<br/><br/>I do not know what of my work has been scrapped for gen ai models like Mid Journey or Dall-e.<br/><br/>My work should be protected and not used in their models unless they seek permission to begin with. I think the companies that own these models should start fresh with free source images unless they seek permission, artist names should not be allowed in search queries or if they are with permission the artist should be compensated.<br/><br/>They are profiting from artists work freely, without permission<br/><br/>Below is an example of an ai generated image of a gun concept which even produced remnants of Bungie&rsquo;s logo in the final generated image.<br/><br/>It&rsquo;s just one example of how the ai models are directly copying parts of original artists/companies images.<br/><br/>Source was found on facebook.<br/><br/>Thankyou for spending the time reading my comment!<br/><br/>Daniel<br/><br/> <br/><br/>",[],"Comment from Walsh, Daniel",2023-11-01T04:00:00Z
"I am a writer, hoping to get published one day and I draw as a hobby too.<br/><br/>I believe AI art is not copyright infringement. AI &quot;training&quot; on art and writing is no different from a human viewing and reading things to learn. AI does not use and mash pixels together as some believe. I think this source here is good for proving AI art isn&#39;t violating copyrights. https://thecodebytes.com/is-ai-art-theft/ ",[],"Comment from whittle, stephanie",2023-10-31T04:00:00Z
"I cannot answer the questions given point by point, given the character limits, but I will try to state my broad concerns addressed in them:<br/><br/>1) Because AI is not sapient and cannot comprehend its input or output, none of its works can be said to be &quot;intellectual&quot; property. While the models are impressive and often put out results that are comprehensible to humans, the machine does not understand or care about what it has produced.<br/><br/>2) The humans running the machine did not produce the work, either, even if they did write the prompt; even if they carefully honed the prompt over time. I have commissioned human artists for artwork before; while I then own the right to use it for personal purposes, the copyright for that piece remains theirs unless I specifically buy it from them. The artist did the labor; I just laid out the specifics. *I* am not the artist of that piece; I am a client, even if I buy my way into being a copyright holder. It seems wildly unprecedented to me for a human to claim authorship of a commissioned piece, just because the &quot;artist&quot; was a machine instead of a human.<br/><br/>3) All major AI models have been trained on art and writing for which it did not receive authorial permission. AI does not cite its sources, and even the creators of the models cannot track where the machine did its learning, or precisely how it compiled its output. And since it is not actually intelligent, the AI cannot make decisions or be held accountable for what kind of things it learns, or who to credit for them. Until this is resolved, current models seem to me to be fundamentally unethical--the model consumes work it does not own, benefiting from the labor of creators who will never see a dime from the AI&#39;s profits.<br/><br/>4) There may, in the future, be an ethical way to produce AI-generated writing, as the models gain a more advanced command of the rules of English. Words have limited meanings, and no one person can copyright basic parts of speech. I believe this would only be limited to more technical writing--there are only so many ways, for instance, to describe how to operate a toaster. A dozen human writers working independently would all produce similar-sounding work, without plagiarizing at all. Perhaps AI can one day be considered equal to such a task. I do not think AI is there yet, with so many unresolved issues surrounding its sources.<br/><br/>5) I do not see any way that there will ever be ethically-produced AI-generated art--especially graphic and visual art, but also music, poetry, etc. While *words* are largely static and for use by all, *art* is innately personal to the artist. Their handwriting, their brushstrokes, the way they see and abstract and represent their observations; their conventions, their stylistic markers, etc. AI cannot innovate. It cannot imagine. It cannot experiment. It cannot interpret. It has no lived experience. It can only acquire, and systematize, and repurpose. AI generated art of all forms is innately derivative, with no way to make it otherwise. While all artists must take inspiration from others, AI cannot be inspired; it can merely copy. I cannot see a way it will ever *not* infringe upon human authorial rights; I cannot see a way it can ever produce any art that should be considered original or copyrightable.<br/><br/>6) I believe AI should be regulated to only harvest data from those who opt-in with specific permission. In other words, existing email, cloud storage, social media sites, etc., should not be allowed to simply insert a clause into their TOS to allow themselves to train their machines on their users. Such methods are easily missed by users, and it essentially holds them under duress to pressure their consent.<br/><br/>7) I believe AI should be regulated so that any services run by image or language generators should clearly and plainly disclose themselves as such. i.e., Tech support chat bots, automated tellers, etc. It is my belief that people should never be duped into thinking they are interacting with a human if they aren&#39;t.<br/><br/>8) I believe that, going forward, if there *are* AI-generated works that allow a human to hold copyright and financially benefit from them, that human *must* also be held accountable for what the AI creates. This includes plagiarism, illegal / incendiary output, being trained on non-permitted sources, etc. Humans should should not gain benefits from owning/using an AI to create *unless* they are liable for its output, as well.",[],"Comment from Beattie, Amanda",2023-10-31T04:00:00Z
"I believe training AI using copyrighted material should involve the consent of the creator of said copyrighted material. This should be done before training and proper effort must be made to ensure that the creator is fully aware of the terms in giving their consent, such as the case of opt in and opt out systems. The creator should also have the right to dictate how their work will be used by developers and users of AI.",[],Comment from Anonymous,2023-10-31T04:00:00Z
"AI blatantly steals from artists, writers, and other creatives to make a worse version of it for themselves by Frankensteining them together. Usage of AI for creative works should be illegal.",[],Comment from Anonymous,2023-10-31T04:00:00Z
"AI image generators is what I have the most experience with; unlike in a regular search engine, an AI image generator removes the owner of art, and combines pre-existing art with other pre-existing art - always without crediting its original creators. The end result is a collage that lacks imagination, originality, and any kind of creative skills. It is stealing labour from artists, who already struggle to be paid fairly in a capitalist system that devalues the existence and significance of arrt, whilst still constantly using it, and taking advantage of its creators. The lack of protection that regular artists struggle with is only going to get worse the more pervasive generative AIs become, and without regulation, it will be impossible to have ownership over work you have created.",[],"Comment from Olorenshaw, Molly",2023-10-31T04:00:00Z
"I believe that companies developing generative AI technology should have to acquire written consent from every person whose work they use to train their models, requiring opt-in, not opt-out. The burden should be on those who seek to profit from other people&rsquo;s work to gain permission from those people; ordinary citizens should not be burdened with the responsibility of seeking out every single corporation who might want to exploit their work. I understand that large sample sizes are crucial for training these neural networks, but those sample sizes should be sourced ethically, and that means informed consent. <br/><br/>Individuals should not be allowed to copyright work generated by these algorithms. If profit is generated from AI, it should be distributed among everyone whose work went into the creation of the neural network, including people whose data was used to train said network. Tech companies should have to keep detailed registers of where they sourced their data, who the original author was, when the data was sourced, and how it was acquired. There should be a governmental standard for records of provenance, and there should be penalties for noncompliance. <br/><br/>Tech companies must do everything in their power to make the utilization of AI identifiable: requiring licenses for use, retaining records of who used the technology and when. Most importantly, if AI technology is abused in any way, the creator of the neural network should be held liable for damages. Hopefully, this will incentivize better record-keeping, and a more mindful attitude about the harm that neural networks can cause in the wrong hands.",[],"Comment from Cohen, Emi",2023-10-31T04:00:00Z
"I personally think that the act of creating Ai creative work should be terminated completely, however the act of monetizing said work for commercial benefit should not be allowed. Many artists have had their work stolen and used to create Ai artwork and have had their art been used to train Ai programs without proper permission to do so. Ai artwork has the possibility to rid artists of their jobs and we&rsquo;ve already seen examples of company&rsquo;s use Ai artwork as promotional material (ex. See Cytus 2 &amp; Netflix) ",[],Comment from Anonymous,2023-10-31T04:00:00Z
"AI at its core is just a hi-tech aggregator of the creative work of millions of uncompensated creators and workers. <br/><br/>As a producer, filmmaker, stock footage provider and the plaintiff in Allen v. Cooper I continue to be dismayed by the blatant and ongoing theft of our intellectual property by AI companies. <br/><br/>For example, doing a quick search for my own unique content of footage from the Blackbeard&rsquo;s Queen Anne&rsquo;s Revenge Shipwreck Project on the &ldquo;Have I Been Trained&rdquo; website, I discovered that at least three of my copyrighted &amp; watermarked images (HIBT Screen Shot 2023-10-06 at 8.59.35 AM.png &ndash; attached) had been scraped. These images and my personal work/industry/creations were stolen without my knowledge, permission or license. Who knows what other images and video have been illegally appropriated from my still and video collections by AI companies? And, even if I&rsquo;m aware of the misuse of my intellectual property by AI pirates, what remedies do I have in this &ldquo;after the fact situation?&rdquo;<br/><br/>In a pattern of behavior even Charles Dickens would recognize the tech industry has shamelessly made indentured servants of us all, monetizing our work and creations without compensation while simultaneously monetizing our creative output for their own financial gain. <br/><br/>Frederick (Rick) Allen<br/>Nautilus Productions LLC<br/>",[],Comment from Nautilus Productions LLC,2023-11-01T04:00:00Z
"With the increment of AI usage, it has come to many the attention of copyright issues. While AI has the potential of being of great function, it seems to be leaning toward a harmful road. The usage of AI has been used to create creative outlets, such as: writing, art, music and homework essays, etc; by modifying various figures/types of styles to create ONE sole piece.<br/>This is quite harmful since it destroys the creativity and hard-work for an individual without giving the credits of their work. I understand that AI does its work by its self, but it does it by COPYING first.<br/>Please take that into notice.",[],Comment from Anonymous,2023-10-31T04:00:00Z
